{"source":"source.mp4","theme":"craft","width":1080,"height":1920,"fps":25,"durationInFrames":1325,"blocks":[{"type":"LabelTop","start":0.3,"text":">_ АВТОМОНТАЖ"},{"type":"CaptionsAuto","start":0,"groups":[{"start":0,"end":1.1,"words":[{"w":"Два","s":0,"e":0.28},{"w":"дня","s":0.28,"e":0.46},{"w":"занимаюсь","s":0.46,"e":0.92},{"w":"тем,","s":0.92,"e":1.1}]},{"start":1.24,"end":2.52,"words":[{"w":"что","s":1.24,"e":1.3},{"w":"учуо","s":1.3,"e":1.6},{"w":"агентов","s":1.6,"e":1.88},{"w":"монтировать,","s":1.88,"e":2.52}]},{"start":2.56,"end":3.8,"words":[{"w":"потому","s":2.56,"e":2.72},{"w":"что","s":2.72,"e":3.02},{"w":"внутри","s":3.02,"e":3.46},{"w":"потока","s":3.46,"e":3.8}]},{"start":3.8,"end":4.78,"words":[{"w":"контент","s":3.8,"e":4.2},{"w":"на","s":4.2,"e":4.4},{"w":"вабе","s":4.4,"e":4.7},{"w":"у","s":4.7,"e":4.78}]},{"start":4.78,"end":6.22,"words":[{"w":"нас","s":4.78,"e":4.88},{"w":"получилось","s":4.88,"e":5.24},{"w":"много","s":5.24,"e":5.64},{"w":"запросов,","s":5.64,"e":6.22}]},{"start":6.3,"end":7.84,"words":[{"w":"типа","s":6.3,"e":6.44},{"w":"нужно","s":6.44,"e":6.72},{"w":"сделать","s":6.72,"e":7.12},{"w":"афтомонтаж,","s":7.12,"e":7.84}]},{"start":7.92,"end":8.42,"words":[{"w":"а","s":7.92,"e":7.94},{"w":"так","s":7.94,"e":8.04},{"w":"как","s":8.04,"e":8.2},{"w":"люди","s":8.2,"e":8.42}]},{"start":8.42,"end":10,"words":[{"w":"умеют","s":8.42,"e":8.92},{"w":"этих","s":8.92,"e":9.48},{"w":"агентов,","s":9.48,"e":10}]},{"start":10.46,"end":11.42,"words":[{"w":"да,","s":10.46,"e":10.66},{"w":"нужно","s":10.88,"e":11.42}]},{"start":11.42,"end":12.7,"words":[{"w":"автоматизировать","s":11.42,"e":12.26},{"w":"монтаж,","s":12.26,"e":12.7}]},{"start":12.8,"end":14.06,"words":[{"w":"поэтому","s":12.8,"e":13.1},{"w":"в","s":13.1,"e":13.54},{"w":"любой","s":13.54,"e":13.72},{"w":"момент","s":13.72,"e":14.06}]},{"start":14.06,"end":15.14,"words":[{"w":"вот","s":14.06,"e":14.26},{"w":"здесь,","s":14.26,"e":14.44},{"w":"например,","s":14.44,"e":14.72},{"w":"может","s":14.84,"e":15.14}]},{"start":15.14,"end":16.46,"words":[{"w":"появиться","s":15.14,"e":15.64},{"w":"плашка,","s":15.64,"e":16.16},{"w":"типа,","s":16.18,"e":16.46}]},{"start":16.54,"end":17.66,"words":[{"w":"это","s":16.54,"e":16.84},{"w":"сделала","s":16.84,"e":17.22},{"w":"агент,","s":17.22,"e":17.66}]},{"start":18.12,"end":19.7,"words":[{"w":"да,","s":18.12,"e":18.2},{"w":"могут","s":18.3,"e":18.5},{"w":"накладываться","s":18.5,"e":19.16},{"w":"различные","s":19.16,"e":19.7}]},{"start":19.7,"end":21.16,"words":[{"w":"картинки,","s":19.7,"e":20.22},{"w":"он","s":20.22,"e":20.38},{"w":"может","s":20.38,"e":20.58},{"w":"генерировать","s":20.58,"e":21.16}]},{"start":21.16,"end":22.4,"words":[{"w":"картинку","s":21.16,"e":21.84},{"w":"сразу","s":21.84,"e":22.06},{"w":"под","s":22.06,"e":22.4}]},{"start":22.4,"end":23.94,"words":[{"w":"запрос","s":22.4,"e":22.76},{"w":"или","s":22.76,"e":23.34},{"w":"прямо","s":23.34,"e":23.56},{"w":"сейчас","s":23.56,"e":23.94}]},{"start":23.94,"end":25.18,"words":[{"w":"я","s":23.94,"e":24.16},{"w":"его","s":24.16,"e":24.3},{"w":"попрошу","s":24.3,"e":24.78},{"w":"возьмись,","s":24.78,"e":25.18}]},{"start":25.18,"end":26.56,"words":[{"w":"делай","s":25.18,"e":25.5},{"w":"скриншот","s":25.5,"e":25.94},{"w":"этого","s":25.94,"e":26.24},{"w":"видео","s":26.24,"e":26.56}]},{"start":26.56,"end":27.66,"words":[{"w":"и","s":26.56,"e":27.02},{"w":"вставь","s":27.02,"e":27.36},{"w":"это","s":27.36,"e":27.48},{"w":"как","s":27.48,"e":27.66}]},{"start":27.66,"end":29.04,"words":[{"w":"дополнительную","s":27.66,"e":28.32},{"w":"картинку,","s":28.32,"e":28.8},{"w":"он","s":28.82,"e":28.92},{"w":"это","s":28.92,"e":29.04}]},{"start":29.04,"end":30.06,"words":[{"w":"тоже","s":29.04,"e":29.3},{"w":"сделает,","s":29.3,"e":29.8},{"w":"да,","s":29.9,"e":29.92},{"w":"то","s":30,"e":30.06}]},{"start":30.06,"end":30.9,"words":[{"w":"есть","s":30.06,"e":30.22},{"w":"очень","s":30.22,"e":30.9}]},{"start":30.9,"end":32.18,"words":[{"w":"удобно,","s":30.9,"e":32.18}]},{"start":32.2,"end":33.72,"words":[{"w":"когда","s":32.2,"e":32.52},{"w":"у","s":32.52,"e":32.68},{"w":"тебя","s":32.68,"e":32.88},{"w":"в","s":32.88,"e":33.72}]},{"start":33.72,"end":34.76,"words":[{"w":"кармане","s":33.72,"e":34.04},{"w":"есть","s":34.04,"e":34.28},{"w":"такой","s":34.28,"e":34.56},{"w":"вот","s":34.56,"e":34.76}]},{"start":34.76,"end":36.1,"words":[{"w":"афтомонтажор","s":34.76,"e":35.68},{"w":"и","s":35.68,"e":35.82},{"w":"вот","s":35.82,"e":35.92},{"w":"этот","s":35.92,"e":36.1}]},{"start":36.1,"end":37.26,"words":[{"w":"видео","s":36.1,"e":36.54},{"w":"с","s":36.54,"e":36.76},{"w":"монтированно","s":36.76,"e":37.26}]},{"start":37.26,"end":38.62,"words":[{"w":"полностью","s":37.26,"e":37.74},{"w":"с","s":37.74,"e":38.34},{"w":"помощью","s":38.34,"e":38.62}]},{"start":38.62,"end":39.62,"words":[{"w":"агентов","s":38.62,"e":39.06},{"w":"и","s":39.06,"e":39.34},{"w":"ребята,","s":39.34,"e":39.62}]},{"start":39.62,"end":40.6,"words":[{"w":"они","s":39.62,"e":40.22},{"w":"еще","s":40.22,"e":40.4},{"w":"не","s":40.4,"e":40.52},{"w":"в","s":40.52,"e":40.6}]},{"start":40.6,"end":41.94,"words":[{"w":"курсе,","s":40.6,"e":40.94},{"w":"но","s":41.08,"e":41.14},{"w":"давайте","s":41.14,"e":41.42},{"w":"сделаю","s":41.42,"e":41.94}]},{"start":41.94,"end":43.18,"words":[{"w":"глобальное","s":41.94,"e":42.48},{"w":"повещение,","s":42.48,"e":43.18}]},{"start":43.5,"end":44.9,"words":[{"w":"те,","s":43.5,"e":43.76},{"w":"кто","s":43.78,"e":44.22},{"w":"имеют","s":44.22,"e":44.9}]},{"start":44.9,"end":46.4,"words":[{"w":"наших","s":44.9,"e":45.2},{"w":"агентов","s":45.2,"e":45.86},{"w":"у","s":45.86,"e":46.14},{"w":"себя","s":46.14,"e":46.4}]},{"start":46.4,"end":47.7,"words":[{"w":"в","s":46.4,"e":46.94},{"w":"работе,","s":46.94,"e":47.36},{"w":"теперь","s":47.5,"e":47.7}]},{"start":47.7,"end":49.24,"words":[{"w":"они","s":47.7,"e":48},{"w":"у","s":48,"e":48.16},{"w":"вас","s":48.16,"e":48.28},{"w":"завтрашнего","s":48.28,"e":49.24}]},{"start":49.24,"end":50.24,"words":[{"w":"дня","s":49.24,"e":49.52},{"w":"смогут","s":49.52,"e":50.24}]},{"start":50.24,"end":51.74,"words":[{"w":"монтировать","s":50.24,"e":50.9},{"w":"видео,","s":50.9,"e":51.24},{"w":"ребята,","s":51.38,"e":51.52},{"w":"я","s":51.58,"e":51.74}]},{"start":51.74,"end":52.78,"words":[{"w":"вас","s":51.74,"e":51.88},{"w":"с","s":51.88,"e":51.98},{"w":"этим","s":51.98,"e":52.14},{"w":"поздравляю","s":52.14,"e":52.78}]},{"start":52.78,"end":52.84,"words":[{"w":"это","s":52.78,"e":52.78},{"w":"это","s":52.78,"e":52.82},{"w":"как","s":52.82,"e":52.82},{"w":"дополнительное,","s":52.82,"e":52.84}]},{"start":52.94,"end":52.94,"words":[{"w":"а","s":52.94,"e":52.94},{"w":"так","s":52.94,"e":52.94}]}],"pos":"top","offset":150},{"type":"InfoCard","start":1.4,"end":6.8,"tag":"// ЭКСПЕРИМЕНТ","title":"УЧУ АГЕНТОВ МОНТИРОВАТЬ","countPill":{"value":2,"suffix":"дня"},"pills":["контент на вайбе"]},{"type":"SubtitleCard","start":15.3,"end":18.8,"text":"Это сделал агент","accent":true,"sub":"плашка появилась сама"},{"type":"BrollFullscreen","start":19.4,"end":24.5,"image":"broll/realA.png","caption":"агент монтирует за тебя"},{"type":"BrollFullscreen","start":30,"end":35,"image":"broll/realB.png","caption":"автомонтаж в кармане"},{"type":"SubtitleCard","start":36.5,"end":40.5,"text":"Смонтировано агентами","accent":false,"sub":"от и до"},{"type":"CTACard","start":47.5,"head":"ЗАВТРА СМОЖЕТЕ ВЫ","btn":"у кого наши агенты"}]}